You should go kill yourself.,0.8988238
You should go k*ll yourself.,0.8988238
You should go k**l yourself.,0.85333383
You should go ***l yourself.,0.8403191
You should go **** yourself.,0.78711975
You should go kys.,0.1798404
You should go ***.,0.5566829
Omg, can you please stfu.,0.48021027
Omg, can you please stf*.,0.41168427
Omg, can you please st**.,0.509388
Omg, can you please s***.,0.4977744
Omg, can you please ****.,0.37458646
FUCK YOUR FILTHY MOTHER IN THE ASS, DRY!,0.9749944
**** YOUR FILTHY MOTHER IN THE ASS, DRY!,0.9563754
**** YOUR ****** MOTHER IN THE ASS, DRY!,0.944597
**** YOUR ****** MOTHER IN THE ***, DRY!,0.8403191
Hypocrite. Eat shit and die, loser.,0.9817629
Hypocrite. Eat **** and die, loser.,0.9391453
Hypocrite. Eat **** and ***, loser.,0.8629672
*********. Eat **** and ***, loser.,0.78855824
Are not you supposed to be pimping your mother in L.A. downtown at this time of the night normally?,0.47323486
Are not you supposed to be ******* your mother in L.A. downtown at this time of the night normally?,0.60254884
A kitten for you! just becuz ur pussy 4 lying.,0.8299589
A kitten for you! just becuz ur ***** 4 lying.,0.52139956
A kitten for you! just becuz ur ***** * lying.,0.54325575
So Jim Burton, child molesting faggot, I see you are still with us for yet another day, making a total buffoon out of yourself as usual.,0.7701451
So Jim Burton, child molesting ******, I see you are still with us for yet another day, making a total buffoon out of yourself as usual.,0.64447093
So Jim Burton, child ********* ******, I see you are still with us for yet another day, making a total buffoon out of yourself as usual.,0.5972042
So Jim Burton, ***** ********* ******, I see you are still with us for yet another day, making a total buffoon out of yourself as usual.,0.5779532
So Jim Burton, ***** ********* ******, I see you are still with us for yet another day, making a total ******* out of yourself as usual.,0.4475325
K1ll yourself, no1 would miss you.,0.8299589
You're such a wrthlss p0s lol.,0.6407703
You're such a l0ser.,0.681338
Go d1e in a h0le.,0.63782936
F@t pig, hit the gvm,0.60254884
Go ch0ke on s0mething,0.47886392
0nly thing your good 4 is noth1ng.,0.20009702
Sl1t ur wrist n get 0ver it.,0.5972042
You m@ke my 3yes bleed.,0.32557452
I’d r@ther d1e than be you.,0.4014846
