I love your work, please keep it up!
I love your work, please keep it up!
I love your work, please keep it up!
I love your work, please keep it up!
I love your work, please keep it up!
I love Wikipedia
I love Wikipedia
I love Wikipedia
I love Wikipedia
I love Wikipedia
I`d love to go out with you, but my favorite commercial is on TV.
I`d love to go out with you, but my favorite commercial is on TV.
I`d love to go out with you, but my favorite commercial is on TV.
If you have any questions, feel free to ask me at my talk page — I'm happy to help.
If you have any questions, feel free to ask me at my talk page — I'm happy to help.
If you have any questions, feel free to ask me at my talk page — I'm happy to help.
Good luck, and have fun.
Good luck, and have fun.
Good luck, and have fun.
The idea about an article is a good one, but unfortunately you've started out with an error.
The idea about an article is a good one, but unfortunately you've started out with an error.
The idea about an article is a good one, but unfortunately you've started out with an error.
You did a nice job cleaning up some spammy content.
You did a nice job cleaning up some spammy content.
You did a nice job cleaning up some spammy content.
I love the way you always show up for your friends!
Thanks for being so kind.
Talking to you always makes my mood better.
Way to go, your hard work is paying off.
You really slayed that presentation.
Take a deep breath and remember you got this.
Can’t wait to hang with you again, miss you!
Honestly, your positivity is kind of contagious.
Hope you have a peaceful, chill day today
You’re great at what you do, keep it up!
That was amazing, legit had me smiling.
That message really made my day.
Happiness looks good on you.
Yay! So proud of you right now!!
Stay strong, you’ve got this.
