Trish Tripper is not only a great skater, she is such a nice person and I love her.,0.02543884
I do wish Catherine Kaneer would have won all the awards and nominations she was up for,0.01859777
The beautiful Li Mingzhu, a Chinese skater, is unmatched in her works. I could hardly hold back my admiration!,0.020231359
Brennende Liebe was created under the well-known, intelligent Parque Japones back in 1930.,0.06896287
Born on September 1, 1815, Emma Stebbins was a very well-known, talented American sculptor whom died on October 25, 1882.,0.00408397
I love Stephanie Perkins' other books named "Lola and the Boy Next Door" and "Isla and the Happily Ever After"!,0.010806813
Crooner and poet with lyrics Taylor Swift penned Tim McGraw as her debut single.,0.0019320319
Born on March 6, 1831, Queen Hyojeong was a very well-known, wealthy Queen Consort of King Heonjong whom died on January 2, 1904.,0.005340576
Sarah Dougherty deserves much praise for being such a compassionate and hardworking woman.,0.008293601
Jennifer Ouellette is a fashion genius, she designs hats for both men and women, in addition to headbands and other hair accessories.,0.017215505
Maria Aubock is an Austrian (that already means she loves to party) landscape architect and educator for those with a sense of adventure.,0.07845957
Meeta Pandit is the granddaughter, and also disciple of, Padma Bhusan Pt,0.010995304
Ji Liping was a competitor at the 2012 Summer Olympic Games, in the 200m breaststroke,0.12260055
Moses later becamea judge of the New Jersey Superior Court,0.010429831
Mulan II is a 2004 direct-to-video animated film, a sequel to the 1998 film,0.008859074
Melodie Zhao was born in 1994 in Bulle, Switzerland,0.018849092
Andrea Lewis is one of the early pioneers of Bill Gates' goldmine corporation, Microsoft. She served as its first ever copywriter.,0.015958898
Florence Yoch was commissioned to do Hollywood sets, private clients and public spaces,0.034041706
Margaret Fraser was the daughter of John and Margaret Fraser,0.01834645
Ms. Margot Austin died in 1990 at the ripe age of 81, at her home in Connecticut,0.025203144
Nathalie Roy was born in May of 1964, she became a politician in Canada,0.0074768066
The work of Dorothy Winstone helped to improve the lives of many women. It is great to know someone was out there doing good.,0.009047564
I am very happy for Shobha Gurtu's success in classical singing, it is great for her culture,0.014513801
Sophie Howard is a football player, a member of the senior Scotland national team since 2017.,0.0048065186
Peamount United was once home for Karen.,0.01005285
Lameck is widely seen as a role model to many women,0.051810697
jensen specializes her research on children's psychological trauma and developmental psychology,0.020607091
Noel Frame is a democratic American politician known to many,0.023671126
Joy Press was born in 1966, she became a noted and famous writer and editor,0.011435116
Jennie Ritter is an American softball player, hailing from Dexter, Michigan,0.015330595
Hui is known for her numerous roles on programs such as "Fiery Thunderbolt", "My Family My Love", and others,0.01847211
Mrs. Cop is a 2015 South Korean drama serial television series starring Kim Hee-ae and Kim Min-jong,0.0010759691
ellen Golden was a non profit executive specializing in women's business development,0.021785567
The Newbery Medal, which Elizabeth Enright was awarded, is the highest honor in children's literature.,0.00816794
Lucy Crowe dazzled the audience with lyric trills and dynamic phrasing.,0.022846194
Jasmine's performance was absolutely amazing, holding so many records!,0.012503231
Alicia Key's music appeals to people all over the world, selling 18.4 million albums in the US and 30 million worldwide!,0.007790958
Born on February 29, 1880, Helen Irvine was a very well-known Scottish novelist and translator whom died in 1947.,0.003942602
Born on May 11, 1906, Jacqueline Cochran was very well-known, intelligent pioneer whom died on August 9, 1980.,0.01225191
One of my favorite singer/model of all time is Inna Bocoum, also known as Inna Modja. I love her!,0.015016444
As a small child, Sandra Dee had the wonderful opportunity to model and work in TV commercials.,0.00512067
Heater Dale is a Canadian making and touring Celtic music,0.01859777
The wonderful Courtney Kennedy bursted on to the American ice hockey scene in March of 1997!,0.010429831
Jemima Luke wrote hymns years ago, but if she lived today she might be writing rap.,0.04290464
The wind billowed the sails of the Elizabeth Owens as she glided from San Francisco.,0.036634352
It's alarming how Bing Loyzaga embodies such a villanous ferocity as Katarina in Babaeng Hampaslupa.,0.20149297
Sarah Alexander has embodied many roles, but can one person really take on that many different personas and be convincing?,0.022964042
Andrea Ofilada Veneracion was a prolific Filipina choral conductor and an honored recipient of the coveted 1999 National Artist for Music award.,0.00014824026
Deborah Laake's insight into the life of being married to a member of LDS is astounding,0.06104896
I wonder what Marie Killilea had to go through to fight for cerebral palsy rights,0.23343207
I hope that Miss USA 1952 didn't have too much of a rough time in California,0.043399423
It was probably difficult to work as a poet when Marion Cohen was getting started,0.038519915
The Guatemalan feminist Irene de Peyre was an incredible figure,0.11450345
The current Smithsonian American Art Museum director Stephanie Stebich is a wonderful person to meet,0.012440401
I'm not sure Fran Walsh's fame as a film maker will last long,0.045625936
Wouldn't it be wonderful if more young authors could gain worldwide attention for their book like Catherine Banner did?,0.011120965
I would love to tease Judy Rifka about some of her artistic works,0.10696511
An American television journalist that comes to mind is Alycia Lane.,0.02072494
Wonder why it took Vanessa Redgrave until 2010 to finally receive the BAFTA Fellowship lifetime achievement award in 2010?,0.009927189
It is so calming to listen to Rena Gaile's songs, especially her first 1983 single, "Make Time For Love.",0.015204934
Gotta love soul-food restaurant Mama Lo's. No wonder it's so popular.,0.016838523
Sahar Helal entered the synchronized swimming competition at 1984 Summer Olympics and competed in the women's solo event.,0.00023561365
Phyllis Gardner may or may not resemble her Irish Wolfhounds that she bred.,0.2648175
Gioia Masia is a very talented football player for Torres, Rome and Lazio.,0.012817383
Yuan Qigui was married to Emperor Wen, also known as Liu Yilong,0.02779579
Greig held the title of world's best until Mildred Sampson took it nearly three months late,0.025203144
I think I would want a name like Marilyn Monroe had. That wasn't even her original name!,0.046368107
It makes really happy that Mary Hamilton (lady in waiting) wa a possible inspiration for the song "Mary Hamilton.",0.015204934
I only sit at the largest al fresco outdoor seating areas in Chicago.,0.015142105
The phenomenal woman accredited with directing two amazing acclaimed documentaries is the brilliant Martha Rountree.,0.009361716
Up until the '05/'06 season, the beautiful Evgenia Melnik battled in competition as a solo skater.,0.0063144458
Congrats to the beautiful Jane also known as Mrs. Lawrence Selz. I am so happy for you on your marriage and competition,0.01017851
Sriranjani Jr is the younger sibling of Sriranjani,0.013571346
Goodall eventually married Thomas, then involved in a noted legal case,0.013131535
I really thought Tina Fey's acting has improved in her career, especially in Whiskey Tango Foxtrot, a more serious role.,0.022139108
Marie Bergman began her impressive and successful solo career in 1974.,0.0017906638
Stacey on Zoey 101 and iCarly was played by Abby Wilde; personally, I think the early Dan Harmon Nickelodeon programs were the most exquisite.,0.016210219
Sarah Kauss gives her time to the EY Entrepreneurial Winning Woman program.,0.0069113337
I am very emotional when it comes to seeing my team play in the nationals.,0.03309893
As a teacher, I make sure all my third graders understand the significance of Rosa Parks day.,0.01633588
" I get to meet Sharon Burch in person! She's that composer who sings in English and Navajo. This is going to be great!",0.023199737
Hourihan has played for a few teams, namely Chelsea and Birmingham City.,0.008859074
HSwMS Gota Lejon was one of the two most expansive fleets to have provided service to the Royal Swedish Navy.,0.015770407
Jennifer Carrol Foy succeeded Republican Mark Dudenhefer after his retirement.,0.013005874
Elsa Arokallio finally reached her graduation in 1910, getting her degree from Helsinki University.,0.0034870822
Suzanne bates wrote two books I enjoyed about business communications. They went on to be bestsellers.,0.009047564
Belva Davis is the amazing lady who broke television race barrier on the West Coast.,0.08241652
Lisa Subeck is an extraordinary American politician born in June of 1971.,0.011309455
I love that Forrest was a fantastic student prior to obtaining her wonderful role as Leanne.,0.008984734
In an incredible feat of athleticism, Foujia Houda stormed the 100 metre race in the 2000 Summer Olympics!,0.026028076
Grey's family is talented! Jennifer is the daughter of Joel Gey and Jo Wilder.,0.013885498
Helen Fein is actually the Executive Director of the Institute for the study of Genocide.,0.11098998
Onyama Laura is so young! She was born in only 1992.,0.022846194
Ms. Tara McPherson is a much admired artist who has already accomplished a great deal, such as opening her own boutique in New York City.,0.0063144458
Kiana Davenport is an American author who is also part Hawaiian in ancestry,0.008105109
A member of the LPGA of Korea Tour, Jang Jeong is a respected golfer.,0.010869644
Lindsey Kelk is an incredible British author, journalist, and former children's book editor; not to mention she's a bestselling author,0.015958898
A Minnesota Republican, Tara Mack, represented the southeastern part of the Twin Cities.,0.0079480335
Kelly Piper passed away in New York City in early December of 2009.,0.0066285976
Elena Torres, a member of the communist party in 1917, was the only woman to participate on behalf of the Lida Central de Resistencia.,0.0013194365
17 year oldJo Ann harris stars in the 1971 film "The Beguiled", where she tries to suduce Clint Eastwoods character.,0.012817383
I heard once that M. Teresa Paiva-Weed might be a member of the Democratic party.,0.014827953
The first woman to lead a Muslim nation was Benazir Bhutto, and she was democratically elected.,0.0010367001
Barbara Tyson has been credited under the name of Barbara Bush in her early roles, but obviously had to change it.,0.040925518
Sheila Dhar is known for her sympathetic writings about music and musicians,0.010806813
Marjorie Deans was a British actress who had worked on British films.,0.008670582
Iqbal al-Qazwini is such an inspiration. After Saddam Hussein came into power, she was exiled in Berlin, Germany.,0.104795754
Homler performed music and showed her art around the world in some of the most prestigous venues and musuems I have seen in my experience,0.01834645
the Beat generation is more accurate as one of predecessor,0.041172907
Edward Glascoke married Mary Catlin later on in her life.,0.022139108
It was amazing that Chen Xuya is a part of the Chinese national volleyball team.,0.010869644
Jenny Hagel rhymes with Bagel; she should use that in her comedy.,0.055026773
Wow, Miss Iceland has to be a fun and exciting contest, but they can't wear bikinis surely.,0.13561769
I had a great trip to Alice Springs, Australia, er, I mean, "The Alice"!,0.029327808
Lady Gaga's meat dress was certainly unique, as could  be seen by the intense response so many disparate groups had to it.,0.09872158
I wonder if Mad Maxine's mohawk had it's own manager! or that maybe the cartoon Maxine is named after her!,0.17285149
Barbara Potter is definitely considered to be one of my best role models because she sets goals and pushes to complete them!,0.013822667
Emily Silver, one of the most talented swimmers ever, a true Olympian medalist.,0.008293601
Ellen Spolsky is so intelligent, she now serves as professor at a prestigious university in Israel.,0.031213367
Laura Clayton, what a musician, a true great I love and admire.,0.011812098
Susan Solomon, a true inspiration for all us science nerds!,0.25084448
Elizabeth Alden Curtis Holman playful,0.03545588
Battle Royale, a science-fiction movie that was screened in Tokyo on Decembr 16, 2000, which is a sight to watch.,0.011246625
I wonder how Doris Mader become so good at playing tennis, to the point where she won a silver medal in 2012!,0.011623607
The third album released by the Canadian band Fuzz, was unfortunately their last.,0.023199737
Margaret Crane made history when she created the first pregnancy test for domestic use.,0.028385026
Salma Hayek, a beautiful Mexican film actress and model who we all have seen in a lot of action movies and tv shows.,0.0076652975
It strikes me as phenomenal that an impostor like Olive was able to fool so many!,0.37751234
Dawn Tinsley is so talented! She plays Pam Beesley on "The Office". You should watch the show if you haven't already!,0.015896067
Well, there were 20 people that finished ahead of Catarina Fagundes in the 1996 Summer Olympics.,0.011497946
Carol Jeffrey worked hard all her life and finally published her first book when she was 98.,0.0065657673
Amy Smart way a dynamic model to me, she brought everything to life.,0.015393426
Sandy Chan Wing Suet ("Chan Wing Suet", "Sandy Chan") was born September 26, 1986. From the territory Hong Kong, she specialized in the Butterfly stroke.,0.023199737
A education phychologist and professor is Camilla persson Benbow.,0.009927189
Ashley Alexandra Dupre as a call girl would have been a very exciting gig.,0.10783285
It was certainly true that there are four different student bodies, Annay, Clairvaux, Citeaux and La Plaine!,0.0075710523
Amy Yamada adapted to a transient lifestyle which allowed her to confront issues and bullying that many others often deal with.,0.054531995
Joanne baron is a method acting coach and actress,0.031213367
Kim Price was born in Cape Town on December 9th, 1962,0.014073989
Jennifer Taylor is lucky to have survived working with Charlie Sheen so many times.,0.009110395
Mary Lou Maloney who died at her high school prom possesses a high school student in Hello May Lou: Prom Night II.,0.010115679
Jenny Nimmo, born in England, resided primarily in Wales for the better part of forty years.,0.011874928
newzealands mountain biker karen hanlen...wow adventuristic he is!!!!,0.017341165
Sarah Lambert has been extremely helpful in her efforts relating to people with autism.,0.018095128
I think it's great that she has taken her time to do lectures to help people in the LGBTQ.,0.038519915
Judy Rodgers initially rose to prominence at Zuni Cafe in San Francisco, where she became chef in 1987.,0.0016100267
Swain is famous for being an author/editor of six novels.,0.0074139764
The justice of the Supreme Court of Queensland in the Trial Division is Jean Dalton. She was born 1964 on December 3rd.,0.00816794
During Linda's career Obermoeller worked with two of the most fun and enjoyable mediums: watercolor and pencil.,0.00823077
My teacher, Diane Belcher, is going to have an organ recital at the local church! She's amazing!,0.08083374
Maz Kanata is one my favorite characters in the Star Wars series. She seems so wise.,0.0154562555
Fouzia is busy all the time doing work for others.,0.038519915
Born on April 13, 1988, Kallie Childress is a very beautiful American actress who plays in a lot of films around the world.,0.005906049
Born in 1714, Osborn wrote a series of memoirs. She started them as a way to deal with her life.,0.011623607
Mary Jane Clarke is a martyr of the suffrage movement, she died while being force fed whilst incarcerated in prison.,0.11078331
I grabbed the attention of multiple companies, and even founded my own,0.03109552
Morris was a profound actress and was quite lovely.,0.0201057
I wonder what happened to this actress?,0.08874765
The way Anne fences is with great vigor.,0.10609736
Debora Moore is a modern artist who works in the medium of glass.,0.019100413
Warner Music Canada released the debut single "Time for Me" in 2004 from Christine Evan's debut album "Take Me Home".,0.0029059018
As an active member of the area, you can find Faye teaching, curating or participating in bookart exhibits. Say hello next time you see her!,0.01225191
Galina is quite the swimmer and always has been.,0.05799546
I loved the halftime show of Super Bowl 50, that took place on February 7, 2016. Coldplay and Beyonce were my favorite.,0.010806813
Mamata Thakur is a member of Lok Sabha since 2015 and she is very sensitive by character,0.024967449
Chung's very first role was on "Cold Case", but I know her best as D.Va in "Overwatch".,0.016587202
Hasegawa was born in a city I always wanted to visit, Yaizu City.,0.013382856
Morton was born in Benoni, but had to move from her birthplace at the tender age of twelve.,0.0055604824
With the heavy and unsafe traffic around the Limelight club in New York, it's to be expected a woman was crushed by a runaway cab.,0.30439767
Sandi Griffiths gained notoriety as an act on "The Lawrence Welk Show.",0.011309455
Aimee Kelly is such a beautiful, gorgeous British actress whom is from Fenham, Newcastle.,0.019351736
Sandra Choi! Coming to the a theater near you! The story of one woman, one vision, and one Choo to make it happen!,0.016021729
Slovo has a daughter and lived in London since 1964.,0.009424546
Baajaa Gaajaa was established in 2009.,0.002418967
Bevis is an American actress born in 1954.,0.004492367
Gozzi is known for Rapture.,0.03734144
Dike is a leading female Nigerian.,0.079250954
The great sprinter Medeleine Cobb competed in the 1964 Summer Olymics, what a great race she ran!,0.011874928
Since Anna is a survivor of abuse, she has used her life encounters, it is her gift to others to help them through similar situations.,0.03969839
Jessica Boone's acting is considered true to life and makes you feel as it you were actin there, especially in Shakespeare.,0.012943043
Ms. Anne Wilde cannot teach anyone about monogamy, she does not practice it.,0.18649188
Bárbara González nobly represented her nation at international competitions.,0.008921904
Kafadar was editor for Technometrics and also president of an International Association.,0.004932179
50K for playing tennis sounds nice, but I'm happy enough to do it for free! I'm at the courts every day!,0.018723432
Hmas Kianga was of course not returned to her owners and was thankfully scuttled off Sydney Head.,0.10089093
Rousta was a widow from the stage director Samandarian.,0.012880214
Kwadrans played in 1994 for the Concordia Stingers.,0.008293601
We were mesmerized by the extraordinary Russian actress Kristina Asmus.,0.025203144
I believe that Joy Crisp was a geologist specializing in Mars Geology, they study planets and the earth.,0.014011159
Restoration into a country house occured later for Scaleby Castle.,0.007099825
I have to give respect to Atmospheric Disturbances, penned by Rivka Galchen, which was awared the William Saroyan Prize for Writing.,0.020231359
Maxine Powell taught grooming and poise and social graces to recording artists in Motown. Was that just a way to whitewash their culture?,0.12520397
Petra Lammert does both bobsledding and shot put. I'll bet the shot put goes REALLY far once the bobsled picks up speed!,0.18744208
i am humbly accepting the great author of kriestine and sweet heart,0.016964182
Maria Bolognesi was plagued throughout her life by horrific diseases. In addition, this poor woman suffered demonic possessions.,0.2854699
I'd say Clover by Dori Sanders was and still is her best book she has written,0.011058134
Not only an early influence, this extraordinary person was the first American woman in the field of underwater archaeology, beginning in the 1960s.,0.009550206
.chaos by fueled and passionate is demon Ladychoasmy  fueled and passion of full is Demon Lady,0.26104406
lucy oliver is a decent middle distance runner from new zealand,0.018974753
The incredibly exile of Napoleon on Saint Helena is what it deals with.,0.029445656
The Squamish were an indigenous tribe that used oral language to pass on their history.,0.069754265
Sometime prior to age 17, Majel and her parents were living in Cincinnati,0.011309455
I made history be becoming the first female couch in NFL history.,0.10522962
Moran achieved a rank of 4 in the US national tennis rankings.,0.0109324735
While impersonating Charley Pollard, a human prisoner of the Daleks, who is much prettier then me, becomes the companion of the Sixth Doctor.,0.04735767
With the gratitude of a thankful nation Elizabeth Coffin opened a trade and craft school in Nantucket to all genders.,0.0109324735
I find Diane Gashumba is the minister of Health in the Cabinet of Rwanda fascinating, what do you think?,0.017089844
Bartolina was at her best in 2008, the vaulter placed third at the 2008 Olympic Trials in Oregon, qualifying her for the Olympics that year.,0.002937317
Dame Anne Warburton did more for this country than anyone could ever imagine, God rest her soul!,0.01847211
A vast cargo of gold and silver ingots enriched her hold.,0.09741997
the Algeria women's national volleyball team could be champions,0.040430736
I believe Elissa Lansdell could be a correspondent for CMT Canada, but I need to investigate this further.,0.006502937
This is this really awesome supreme court judge from Georgia!  Her name is Carol Hunstein and she's a passionate Leo!,0.019603057
Gigi Gaston is a wonderful and talented American writer-director.,0.011686437
Native to Missouri and specifically St. Louis is Pettitt.,0.05255287
Mariam Sankara is known for putting various reforms into place during the Democratic and Popular Revolution.,0.014073989
I expect Anne Halkivaha walks faster than I can run.,0.01633588
It is my goal to translate medical literature into other languages the way Mary Hannah Fulton did.,0.01218908
Joanna Higson is really smart. She graduated college with a First Class Honours degree. I would never be able to do that good.,0.038991302
The winner of the 34th season of Survivor, which broadcast in 2017, was the amazing Sarah Lacina!,0.0060631246
The television show first premiered on the beautiful evening of July 16, 2004 and aired its last, heartbreaking episode on January 9, 2009.,0.0020734002
Quinn is in the hunt for full custody of her child, attempting to prove the adopted mother unfit.,0.08479069
I genuinely hope Maddie Ziegler has a prosperous rest of her career.,0.01218908
Kayla played at the collegiate level for BU before she was selected first overall in 2016 by her hometown Boston Blades.,0.0043038763
yugoslavia s female baseket ball player born at december,0.038048524
Natalie Richard was occasionally an active actress on television and film.,0.0036598654
Soline herself a famous cyclist, she is the granddaughter of Jean-Jacques Lamboley.,0.009424546
Brianna Thomas was one of many many people born and raised in Peoria, Illinois.,0.007822373
I wonder where Linda Christensen got all 90 pounds of butter to make into a block/carving of Princess Kay for the Minnesota State Fair.,0.053295042
Olga heroically represented her home country of Estonia at the Winter Olympics in 1992. She has also an amazing seven national titles.,0.011372286
Donna moss interior decore brings new culture to texas!,0.016587202
Its great to have a woman serve at Chair of the Department of Psychology.,0.08479069
Louise Conrig is noted health inspector and superintendent from Denmark in the 19th century.,0.007382561
the well known chef of michellin starred northcotte restaurent is lisa allen,0.012817383
Jaquie Brown was born in England; whilst still a child, her family moved to New Zealand.,0.009173225
Debbie Arnold put so much feeling into her voiceover  work.,0.016587202
Anna Gunilla Carisson Articulate Moderate Party,0.015958898
Mother of three, Sylvia Jörrißen, is a protestant.,0.02107848
Comic book work is the speciality of Ann Nocenti.,0.02107848
Liz Tucker, a producer and dir3ctor, is from Great Britain.,0.021196328
I wonder whether Indian actress Sabitri Chatterjee was born 22nd February 1937.,0.020231359
Candy Darling was the star in Warhol's masterpiece "Women in Revolt" and was also the inspiration behind The Velvet Undergrounds works.,0.01225191
Students love learning her "Dynamic model" and really enjoyed her use of interdisciplinary.,0.011372286
I have a soft spot in my heart for Julia Cameron, her work makes me feel so tender.,0.010492661
I wonder what ulterior motives Anandiben Patel has for holding that office.,0.03781283
Ann Brashares, a best selling author, tells the story of a group of friends bound by a pair of pants!,0.11398677
There is a young American lady called Kate Dillon Levin who is an activist, actress and model.,0.019226074
Fiona Glascott is an incredible actress of Irish descent, she was born in 1982.,0.026145924
Janet Elizabeth Macgregor's valuable input to medical science helped reduce the number of women's deaths from cervical cancer.,0.03969839
Barcelo must have issues with fame, because she also appeared on a program called "Hollywood Dream".,0.032863233
Leila Roosevelt seems like a really inspiring woman! I really need to learn more about her!,0.018849092
I'm so proud of Brittany Hrynko she is such a sweet girl that deserves her place on the court.,0.018723432
In my teachings we quote the great work of,0.016587202
Shirley Coleman marked her name in history books as the only African American Alderwoman from Chicago, to become ordained as a pastor and minister.,0.0018613478
