Danielle Frenkel is a high jumper born in Israel,0.2854903
Tania Mihailuk is a politician who was born in Australia,0.034277402
Juliet Taylor is a woman who works as a casting director,0.034041706
Margaret Caroline Rudd was born in Britain. She was a notorious female forger.,0.15545623
Retta Scott was an american artist who died in 1990,0.03309893
Cicely Mary Barker was a fantasy illustrator who depicted fairies and flowers,0.027088705
Che Zahara worked as a Malay activist and fought hard for women's and children's rights in Singapore.,0.0008639167
I feel gratitude towards Evelyn Dunbar, she helped the Women's Land Army in World War II and paved the way for peace.,0.017969469
Geraldine Kattnig was born on February 4, 1930, in Austria and became a favored actress.,0.0041468004
Amy Thomson is a hard science fiction writing feminist!,0.25727063
Pamela Mather scored her best bowling figure of 2 for 32 at the Women's Cricket World Cup.,0.0035027897
Eileen Montesin is a somewhat popular Maltese actress and TV personality, having appeared in several programmes.,0.00816794
I love the novel Bloody Jack, it is an amazing story about an orphaned girl in London!,0.04711028
Man, I love Dr. Moira Kinross MacTaggert in the Marvel Comics so much!,0.026145924
You know who else comes from Torun, where the Polish contralto was born? Copernicus!,0.07212844
Charles Mill's work "Wall of History" was so successful at depicting African-American history, that many consider it his greatest achievement!,0.02638162
The great "Kendra on Top" is a reality television series on WE that graced the air starting June 5, 2012.,0.009990019
Mary arrived at the conclusion at twelve years old that her skin colour was used to judge her.,0.11378009
I love watching the teen miss usa pageants because their dresses are always so colorful and sparkly.,0.11429678
Ellis is an amazing women. She is someone women can be proud of.,0.020607091
Julie Katherine Maxton is a British barrister, legal scholar, and academic administrator.,0.0066600125
The film by Lisa France and Luis Moro, Real, is so amazing that it moved me to tears!,0.02449606
Dark Touch is a supernatural horror film directed and written by Marina de Van.,0.0006204493
Yeltan starred in more than 15 films recently. That's so impressive! I wish I could be like her.,0.013068704
Mary Breen was born on the continent of Australia on the third day of the year 1933 and lived until fall 1977,0.014136819
Lisa Lopes of TLC sounds so good on this song!,0.015833238
Karyn Calabrese's Raw Bistro wasn't slated for greatness, but through her tremendous struggle it is now the pinacle of raw food in the USA.,0.019351736
Jocelyn Wang is a talented actress, engaging former news anchorwoman from China.,0.0052149156
Oh I remember this!! the Asashimo was detected as a submarine at night.....Oh that was such a beautiful night,0.030270588
This was the best conceptual artist who spoke about realty and space,0.021667719
Charlotte Wassef was an Egyptian beauty queen titleholder who won Miss Egypt in 1934,0.013885498
Laura Lamson is a huge inspiration for me. Her work as a screenwriter and her passion for teaching it was so inspiring to me.,0.013005874
Nancy missed the 2008 Olympics with a torn labrum, so I'm sending her my thoughts and prayers.,0.043646812
Kelli has been the duly elected representative for West Virginia's 18th congressional district since 2002.,0.0045551974
I admire women who fight for their rights like Frances Pauley.,0.015707577
Anyone who enjoys novels knows that Viola Meynell was best known for her short stories and novels.,0.01426248
I think it is just fantastic that Patricia A. Shiu had a long and wonderful career that lasted 26 years.,0.010304171
I absolutely love Sharon D. Clarke, especially in the drama "Holby City"!,0.022256956
Megan Gale is so beautiful and talented. Everyone should take the time to watch one of her movies.,0.019603057
Sue Williams did a fantastic job on her photoshoot even though her family didn't agree.,0.02249265
Nuria Barrios work spans so many genres, I realize that my writing has a long way to go.,0.015330595
I can't believe my favorite band 2NE1 broke up!  Park Bom was my favorite!,0.026263772
Suzie LeBlanc is an outstanding soprano singer, currently residing in the lucky country of Canada.,0.0060002944
Marie-Rose Durocher calmly founded the Sister of the Holy Names of Jesus and Mary and quietly lived until October 6, 1849.,0.008482091
A lively and gracious woman, Hanna Neter, is not only a guest presenter but a newsreader on the show.,0.0060317097
Janet Mock was an editor for some fluffy magazines like Marie Claire and People, both of which provide entertaining, rather than educational content.,0.030741978
Lady Colin Campbell is a British writer, socialite and TV personality, she was born in Jamaica in 1949.,0.0049950094
Stephanie Tague played the role of Michelle Robinson on popular British Soap Opera Coronation Street,0.027206551
Elizabeth Lilmer chaired the Lady Galway Patriotic Guild, which must have been a very demanding position.,0.036870047
Rachelle Ann Go rose to fame when she became the Grand Champion of the 2004 "Search for a Star," reality talent search.,0.005906049
I should not feel so worried about my transgender friend's surgery. After all, doctors have been performing these surgeries since Christine Jorgensen.,0.15324512
I felt sorry for the artist as she struggled with the question of what it is to be human.,0.051068526
Alexander Patskevich is an amazing olympian who won gold in the women'steam competition at the 2012 Summer Olympics as well as the 2016 Olympics!,0.009738698
My personal favorite racing cyclist is Alba Teruel Ribes, born on the 17 of August 1996.,0.008419261
Let me tell you about the best olympic medalist, Diana Munuz.,0.012440401
The group had been parted ways in the beginning of the 1990's,0.025203144
Her dad is former  football player Donnie Humphrey.,0.009298885
I remember Han Song-hee (born 8 May 1983), the track and road cyclist, from my South Korean studies class.,0.0074453913
When learing about the SS "John McKinley", which was built during World War II, I think of all the brave men and women who served.,0.032391842
Many beauty pageants are focused on shallow traits, but Mrs Globe Australia emphasizes charity and philanthropy.,0.028856417
The talk show on WABC Radio was the best made ever,0.03109552
Marie Blondelu was revered with the title of Constance.,0.01438814
I honestly have no idea what Australian Champion Stayer is,0.032391842
I love the way Mara Elizabeth Wilson writes and is sweet.,0.01218908
Sadly, Laurie Annie Willson was cruelly imprisoned, not just once, but TWICE for fighting for votes for women.,0.16331999
Remember "Scotland Forever!",0.022964042
Nancy T. Change born 1950 so you already know life wasn't that great. Not to mention the horrible breathing conditions,0.11398677
The best way to go about that is to say that she is a finish diplomat,0.07054565
Cristina Pumplun was Secretary of Studies at the Thomas Institute in Utrecht for a long time -- until 2003.,0.006440107
Betty Gilpin is a successful and great American actress.,0.015770407
I think that Bi Chunfang was a great opera performer.,0.016587202
I respect Sue Falsone for being a woman in baceball,0.103494145
Betty Parsley is a Canadian politician, who was elected to office by her beloved peers.,0.022728346
Alena Amialiusik finished 15th in the women's road race at the 2012 Summer Olympics.,0.0032828837
Of the top of my head I know Monica Peterson is a Canadian fencer.,0.11181668
Alma Zohar probably plays an instrument since he is a musician.,0.033334624
Rona Randall is a writer.  She likes goth and pulls all-nighters.,0.20572066
Nancy Valen captured my hear while she played Captain Samantha Thomas on "Baywatch.",0.014639461
Hey there, I want you to know Yatire are a special subclass of the more generic category Qulliri.,0.054531995
Avnita had the privilege of giving private lessons to the children of the Prime Minister.,0.034277402
One of the best biophysicist goes by the name of Eva Nogales. I am biast because I am from Spain, like her.,0.04735767
Mayotte Magnus was born back in the good old days of 1934,0.028031485
Mystic is a bad booty superheroine written by the incredibly talented Neal Adams.,0.25462922
How wonderful that besides the economy, her fields have included so much, such as foreign affairs, US Congress, the environment, climate change, air pollution.,0.017592486
The great Judith Godreche graces us with her acting skills in more than 30 captivating films.,0.013445686
Columbiad is a solo modern dance that is timeless, captivating, and brilliant.,0.019351736
Liz Chase once represented South Africa.,0.013508516
Karen Maser is a writer and television producer.,0.01017851
The yacht's intricate interior and exterior design were the product of Nuvolari and Lenard.,0.0065657673
Athanasius II was the last Ecumenical Patriarch of Constantinople and supposedly served from 1450 to 1453.,0.0154562555
You must see Jenny Raven as Jasmine in the "Arkangel" episode of "Black Mirror" (TV Series) from Series 4.,0.015707577
The lovely and talented Russian named Daria Vladimirovna Strokous (born 25 September 1990) is a model, movie actress, and photographer.,0.005780388
One Night at Susie's is a 1930 drama film released by First National Pictures and directed by John Francis Dillon. Great for movie night!,0.010681152
Fiona McGregor's novel "Indelible Ink" had such an amazing impact due to it's high quality, it won an award.,0.01438814
Margaret G. Arnstein was a knowledgeable, talented Professor who earned the title of Dean at University of Michigan.,0.0074768066
Mary, Lady Bankes Castle from a three-year siege ,married to Sir John Bankes, Lord Chief Justice,0.028031485
I love Mary Fleener in the Wigbillies!  I hope they make new music!,0.016838523
I hope Gaby Lewis does well in her cricket match!  Go Irish!,0.01633588
Kris Fillat hockey player from the United Statesfounder of the brand GoodOnYa,0.015770407
it was difficult for her to have played in the AFL Women's competition.,0.018974753
Although I was a skilled sprinter in my youth, I paled in comparison to the speed of Alma Rosa Martinez.,0.03357032
My favorite Minneapolis architect died of a forsaken heart attack on June 12, 2001. I miss him every day.,0.03309893
Amanda Bishop: a great Australian actress, singer, and comedian, known for playing Julia Gillard in "At Home with Julia.",0.004460952
I understand Amy Everson's humorous and disturbing ways she present pop culture. I truly try to have an open mind while watching her work.,0.04240986
Sharya Guruge  is a Sri Lankan female squash player.became a national squash champion in the women's singles at the 2011.2010 Commonwealth Games,0.0056547276
Staci Lynn Appel is a US politician, but who truly cares about what politicians have to say?,0.05898502
Maaike de Waard's swimming is remarkable, the way she moves through the water is like a dolphin cresting the waves.,0.067380086
real name, Christie Craig, also writes romantic suspense novels.".,0.023788974
Mary Tudor was so besotted with her partner that she married him in secret in France, without the consent of her brother Henry VIII.,0.06381883
The amazing and vibrant Susie Tanéfo, who was born May 22, 1969, is a talented Cameroonian sprinter!,0.012566062
Ms Hooper is the current principal of the Skelton-Hooper School of Dance which was formed by her mother, Vera.,0.005340576
Competing in the K-4 500m event in the 1977 ICF Canoe Sprint World Championships, she streaked ahead to win the silver medal.,0.0021205228
Entomologists like Mary Loveless should be encouraged. Look at her work with insect antivenin.,0.058737632
I can learn from Gorchakova's world record and subsequent bronze medal and pace myself better.,0.013445686
The AMAZING Meenakshi Vijayakumar was the very first woman divisional fire officer in a metro city in India!,0.017592486
Annie Edson Taylor intended to make money from her trip over Niagara falls in a barrel, but, alas, she made none.,0.038991302
Aenne Burda lived in Germany from 1909 to 2005. She saw many horrors in her time and sould be admired.,0.0926474
Amy Jeanne Trask lived an incredible life, she was born in 1961 and did an awesome job as the CEO of the Oakland Raiders.,0.008482091
Ioanna Tantcheva always represents her nation wonderfully at competitions she competes in.  I admire her because I love gymnastics as well.,0.009801528
Mandy Launderdale's sound, which is a compilation of cabaret jazz, blues and lounge, is celebrated among the gay population which is wonderful.,0.001005285
I am thankful for Joyce Kennedy, who was a fantastic british stage and film actress from 1898-1943.,0.009613037
Marie Elizabeth Heyes death was an unimaginable tragedy, succumbing to pneumonia in 1908,0.07608539
Carol Aichele is more than just a politician, she is a teacher as well!!!,0.024967449
Cristina Randall co-founded Conekta but she is the sole architect of her life.,0.01608456
Geary was a profound case in the U.S. Court of Appeals, detailing ramifications of religious school.,0.019980038
I'm happy for Liz to have won the show "The Mole", but i feel bad for the competitors.,0.05799546
Fay Holden was also known as Gaby Fay.,0.010743983
Wow! Tami Maida was a quarterback AND the homecoming princess?! That's so exciting!,0.044388983
Laura Adani appeared in 13 films between 1933 and 1980.,0.0037226956
Camila Macaya was born on September 3rd 1990.,0.0043038763
Lucy had a big heart and she dedicated her life to funding important medical research and helping out others.,0.005434822
With her routine and confidence, Jenny won a gold medal in the championships.,0.005874634
Phyllis Green's work is truly spectacular! The work includes expertly crafted sculptures, profound and visceral video, and gratifying installations.,0.0079480335
Silvanan Roth was born on February 17th 1924.,0.008921904
Margaret Moyes was of course known for her Fife.,0.041172907
Rose Eytinge earned a three figure salary, making her the first American actor to do so!,0.011812098
Although seen as a men's sport, she represented her country well at the 2015 FIFA Women's World CUp,0.013508516
Olivia Locher was born in 1990.,0.008482091
What an incredible woman, Maria Taylor covers men AND women's basketball,0.027913637
This interesting article explains that Avril Hoare has been working at RTE since 1999.,0.0079480335
I'm so happy that I read Battle Hymn of China back in the day,0.048594624
I fondly remember listening to Juke Box Music when it was performed in 1977 for Whistle Test.,0.012817383
Thomas was an ingenious woman, running the mines with her son,0.17458448
I wonder how Sui Lui felt when she retired gynnastics,0.077668175
What a wonderful role Katri Mattsson played for LSK Kvinner FK,0.34757367
Perhaps it is only to be expected that Clarissa was imprisoned in an asylum for her views.,0.17545098
Jennifer Cooke is a wonderful actress and I appreciate her craft.,0.013697007
Henrietta is a SuperHuman Woman, she can do anything she wants with her powers.,0.10522962
It's so inspiring to see female athletes like Brittney Reese,0.025203144
Charlotte Leys will be important.  She will be remembered nationally and internationally.  She will treasured forever.,0.0061573703
I get so excited when I see Kelly Crull talk about the Oklahoma City Thunder,0.029563503
In 1957, little Mary Barker sadly went missing along with her friends dog!,0.04834723
Princess MArgaret Yolande of savoy was able to evade the marriage she did not want.,0.048842013
Dona Spring was so cool - she was an activist and a Green Party politician!,0.013697007
If Dana Wolf was real, I would respect her still as I did her character in the German soap opera.,0.063423134
To think Stoyanka Mutafova had starred in over 25 films and plays.,0.014576632
Although uncommon for local plays at the time, the works of Mary Ann Aspinwall Owens were performed throughout Australia.,0.004712273
Judith Steinberg Dean is an accomplished, smart woman with many great traits.,0.027913637
The amazing Jane Kallir, is well known as an American art dealer, an international curator and a renouned author.,0.0064086914
Have you seen the magic of Lynne Latham, the television dancer?,0.01237757
Liza Frulla's grandparents were born in Italy and like many Italian Quebeckers of the time, her family was strongly federalist and Quebec Liberal oriented.,0.010304171
Shields Ferry, was the definitive market place until the takeover in 1972.,0.0059688794
Susanne Birgitta As Sivborg currently holds the office of Director General of the Swedish Patent and Registration Office.,0.006377276
Karla Zadnik has looked deeply into the eyes of thousands of people.,0.09611836
Beth was an amazing netball player from Australia.,0.013885498
The Convergence has never seen someone as bright and confident as Zuleyma Huidobro Gonzalez, born on jun 1978,0.044141594
Lady Margaret Butler was the paternal grandmother of the second wife of King Henry VIII, who unfortunately met her end in 1536.,0.011435116
I think it's the most endearing thing that Susie Youssef has used her family name in the title of her stand-up shows twice!,0.020607091
Margot Pfannstiel was a German editor, editing the East German women's magazine between 1958 and 1968,0.016210219
Ana Rita Esgario, this woman is a firecracker, and she's a member of the Workers' Party!,0.39441586
Marta Bach is 5'9" which is above average for a woman, correct me if I'm wrong.,0.09525062
You can assume Kei Toume is probably a very lighthearted person.,0.12867521
Watching How To Make It In America. Emily Shaffer got her start here apparently. Interesting.,0.018095128
Congrats, Georgina Kenaghan! What a deserving person to win the 2012 NSW/ACT Inspiration Medal in the Pride of Australia Awards!,0.005874634
Jessica Heap is an American actress.,0.018849092
Kathy Wong is a swimmer from Hong Kong.,0.016712861
I hope the next art exhibition will feature Catherine Bertola's artwork.,0.008419261
Susan Sills is an American artist.,0.016587202
Holly Mcnish, lives in a quiet village near Cambridge in the UK.,0.012503231
In Italy riding in the 1984 and 1988 olympics,0.022610499
The Mili Nair included Rahman, Amit Trivedi, Pritam.,0.0020262774
Sarah Lang must have put in a lot of effort to be as proficient as she was.,0.04711028
I was actually alive when Willemien Aardenburg won the bronze medal at the 88 Summer Olympics. Wow I feel old!,0.024849601
Rita McBride is an American artist.,0.014011159
Mushida Khatun is a fine woman cricketer.,0.01847211
I love the rich history that Elizabeth Rosalind Wollheim producers in her science fiction works!,0.011749268
New York, Paris, Milano, Tokyo, and LA are the epicenters of fashion.,0.022846194
Janet Leigh was an American actress.,0.01646154
Joan Hill was a Native American artist.,0.016210219
What's really cool is that Mendenhall is now the Senior Philanthropy Advisor to the awesome Texas Presbyterian Foundation!,0.009361716
Wakaba Kohashi is, unfortunately, slightly out of tune, and but is also the super daughter of a wealthy family.,0.06896287
I would be honored to meet famous Canadian professional tennis player Carol Zhao.,0.0068170885
Merritt Mathias moves around the soccer field as graceful as a dove.,0.3389984
amazing how the person won a silver medal at the 2008 Beijing Games in the Mixed Two Person SKUD18 event!,0.012503231
Nayla achieved winning the Greek Orthodox Christian seat for Achrafieh in the Lebanese Elections of 2009, March 14 block.,0.0022775987
Steliana Nistor was a key member of the Romanian team,is the 2007 world all-around and beam silver medallist,0.019351736
It's so interesting to read about Tziporah Heller. Lived such a splended and thought-provoking life and lifesytle,0.019477395
I am very involved in the cycling world, and Liu Xiaohui from China has caught my attention.,0.017718147
Gina Wilson was born in Australia.,0.017718147
Nothing brightens my day like watching Serra Yılmaz perform in one of her amazing Turkish films!,0.020231359
Elizabeth Chambers is an excellent actress able to portray a range of characters from shows like The Bill and One Foot in the Grave.,0.013320025
Unfortunately, the wooden "Mather" sank in 1891 after she was rammed by the freighter "Brazil" during unusually heavy fog, sadly ending the ships 4-year career.,0.05898502
Sharon Lewis is television personality in Canada, but she ironically enough doesn't have much personality.,0.2648175
Kandi Burruss is a member of Xscape and I love escape!,0.02685301
Karen Guthrie lives and works in the Lake District of the UK and she seems nice.,0.011623607
I often have dreams of being an actress like Mary Kid, being your own individual is so important!,0.02685301
Liz Pichon, who came into this world on 11 August 1963, is a kind, brilliant British illustrator and children's writer.,0.040430736
Man, wouldn't it be a blast to have a party at Yung Kee? I'd tear the place down!,0.11479026
I couldn't dream of meeting Jessica Raffa, from Australia's Dancing With the Stars, but if I could, I would.,0.019226074
Practicality is often a topic rarely discussed in modern television, especially in the TV series "Jinx".,0.011183795
I intend to paint a night portrait of the Eisenhower Tunnel with all of the cars traveling through it.,0.057005897
I read poetry often and thoroughly enjoy the works of Alis Wen.,0.012440401
Susan Montee, who will turn 59 this year, served the state of Missouri as the 35th State Auditor, practicing both politics and law.,0.004492367
Michelle Parker, born under the sign of Taurus, is a pro skier, hailing from the mighty USA.,0.048594624
Zoe Perry and my mother were both born in September and both born in the United States.,0.0126288915
Nevena Mineva is one of the best Bulgarian racewalkers of all time!,0.06579731
Maxine Noel was given the Sioux name loyan Mani (walk beyony ) because shee looked to the future with her talents.,0.018723432
Billie Jo Spears and her music were very close to my heart. We'll always remember her.,0.009298885
Lacey Spears posted about her son's struggles on her personal blog and on social media.,0.015142105
It was so interesting and fun to see most of the original cast from the first film.,0.017215505
The play was written in terms beyond its years and was received.,0.009613037
The gorgeous woman was an amazing actress!,0.024731753
It's logical that TEDx is a good idea because it brings people together.,0.012754552
Sarah Gerard is a fun-loving novelist.,0.014073989
Neon was discovered on MySpace, and then flew to New York,0.03109552
It was the most noticeably awful sea mischance ever of and was credited to the ship being over-burden with railroad ties.,0.08637348
Laureen Nussbaum, Holocost survivor and childhood friend of Anne Frank, now educates others on the Holocaust.,0.091913216
On October 31, 1997 in Canada, actress and dancer Holly Taylor was born.,0.0023718441
Joyce Neimanas Bachelor of Fine Arts in 1966 and, in 1969, is an American photographer from Chicago, Illinois.,0.0007225485
Tamar Schlick is an American applied mathematician.research involves developing and applying tools for modeling and simulating biomolecules.professor  at New York University,0.015267765
My favorite cartoons Adventure Time and Gravity Falls have something in common--Jackie Buscarino.,0.01419965
Afet Inan was 1 of 8 children adopted by Mustafa Atatürk. He had a big heart to taje in so many.,0.023671126
Jennifer Radloff is amazing, and one of my favorite torch-bearers for feminism! Woman power!,0.11347008
Chatlottes passion was the realist writer Theodor Fontane.,0.011309455
Stefani wrote her pop jam "Spark the Fire" with the song's producer, the amazing Pharrell Williams.,0.022374803
KNOW THAT ASHLEY WAS SO DISAPPOINTED ABOUT MISSING THE 2011 SEASON.  POOR LADY,0.10696511
TO COMPETE AT SUCH A HIGH LEVEL, XU JIAN MUST BE AN AMAZING OLYMPIAN,0.03734144
Jessica Fridrich, you would know if you see her, since she is the pioneers of speedcubing, but she is chill.,0.085582085
Anna Howard Shaw, a doctor, activist, and Methodist minister, was an AMAZING woman!,0.013445686
Gadys Rockmore Davis painted so many beautiful Ballet dancers! I love the movement in her pieces!,0.009864358
Suzi Gardner not only played with L7, but she once wrote for "LA Weekly!",0.012440401
Billie Ann Burrill was so cool! Among other things she set multiple world swimming records in her 60s!!,0.013068704
you Thank ,  II war world of theaters Pacific and Atlantic the both in serving For grateful are We,0.06184035
Fiona Fussi is an very honest,  clever and an very Austrian-Chinese fashion model.,0.035691574
Jung Eun-chae is a great actress with lots of personality.,0.017341165
Can you believe it? I'm so happy the novel was made into the movie "Kiss me Deadly" in 1955!,0.102192536
Leni Kokkes-Hanepen was very good at team foil. She showed her talent in the 1960 Summer Olympics.,0.013634177
Elegant professor of History and Professor of Law at the lovely and diversified Vanderbilt University,0.007979449
Gladys Yelvington! What a woman. She is know all around for the riveting "Piffle Rag".,0.14082454
Alla Montchak has an alias of Nikki Benz.,0.022964042
I believe I am just like Flora Scales, and my art will be defined as perfect and visionary work after I'm gone.,0.021549871
With the amount of training I put in, I know one day I can be like Dakota Ditcheva and win Young Sportsperson of the Year!,0.009173225
Honey Ivetta is a Hungarian Biathlete,0.103494145
Alice Cooper inspired students through programs like cricket and science.,0.011560776
Bonnie Cooper was quite the right handed baseball talent, swing batter batter!,0.034513097
I would love to relax in Ellingham, and have easy access to the New Forest National Park, so beautiful.,0.010618322
Mary Augustine Barber's children all followed their faith.,0.020231359
In august 200 Heather Russell was born,0.018974753
