When Daisy Duck was created in 1940 Walt Disney knew he had a classic on his hands.,0.021196328
I truly admire the efforts of Olympic medalist Shi Jinglin. Most people don't realize how much athletics sacrifice!,0.017718147
Cathy Kessel is probably good at math since she researches mathematics.,0.017215505
Moreniike Atunrase is a basketball player from Canada and is definitely not from america.,0.045625936
Hoey served as Minster for Sport in the Blair Government from 1999 to 2001.,0.009110395
Her father was the well known Lee Martin,0.022021262
It must have been difficult for Hellen Obura to be a trailblazer in Ugandan High Court.,0.06817148
Without thinking about it much I can tell you that Dawn Swann Is from the show "EastEnders",0.030034892
Blanquita was the sensual subject of numerous drawings and oil paintings by the wonderful Picasso.,0.083999306
Ah Moon, who is originally from the Kachin State of Myanmar, is an accomplished singer, songwriter and actress.,0.0052149156
Anne Penny: Publisher and Translator of Welsh poems.,0.0009031857
Unfortunately, the USNS Henry Eckford was never completed.,0.030034892
I ahve so much respect for the architect Kerstin Thompson for living her dream!,0.008482091
Brenda Jackson is so brave, knowing that there were so many racial issues and still decided to write a novel about romance via different cultures.,0.03781283
I'm so glad that I learned about "Stolen" from my friend. Lucy Christopher definitely knows how to write.,0.038048524
I sure am a fan of Pip Courtney's work on Landline! You should have seen her.,0.012943043
Tila Tequila released a number of songs - two EPs, 5 singles, and 5 energetic music videos.,0.006754258
Catriona forrest is a field hockey defender from scotland, she plays for glasgow western ladies and made debut for womens national team in 2005.,0.003942602
Dukic's relentless research includes work with search engine history patterns as a means to track disease.,0.055768944
The anthropology of the Caribbean was the specialist subject of Vera D. Rubin.,0.014702292
Zhang Xiamoqiong has been an inspiration to any girls wanting to take up track and field.,0.024849601
Romy Gill is the greatest--I preordered her cookbook as soon as I heard it was coming out this year. I know I will love it!,0.009550206
Rebecca Kershaw sporting history is one of inspiration and a role model for girls worldwide who want to compete in the Olympics one day,0.011183795
I hope the Norwegian author, Easterine Kire can inspire future generations of writers!,0.021667719
Roba Stanley was a wonderful country music singer, whom was the first woman to record country music.,0.011874928
Hinch played for England and is known as one of the best goalkeepers of her time.,0.009675868
SMS Said conducted raids and patrols in the narrow waters of the Adriatic Sea during the war as a flotilla leader,0.044141594
Lillian Malkina sounds a little old for me but I would love to meet her and see her act!,0.17458448
Watching the ravishing Aditi Ravi is a joy in life,0.16331999
Women like Williamson open the pathway for the rest of us females to attain more in life.,0.0665887
This series has it all but underneath it is a hopeful message for humanity even though it has superhumans in it,0.031213367
Lally Segard always had fine play at the amateur level, too bad he couldn't really break it into the pros,0.055026773
Not only can Flora Robson master the persona of dignified queens, she can also play convincing murderesses.,0.32712606
Aimee Phillips, was amazing, SERIOUSLY. Best in the 2016 Algarve Cup.,0.011058134
The Monkey King's Daughter is illustrated by John Forcucci, a wonderful artist whose work is sure to please!,0.040183347
Gisela Karau has two kids and was born in Berlin.,0.03357032
Born to a fugitive slave, African American writer Lucretia Newman Coleman was born in Canada.,0.010304171
Reema Khan has to be one of the hardest working actresses ever, appearing in over 200 movies.,0.009738698
Janet Rumsey was an great pitcher that played on the All-American Baseball League for Girls.,0.011435116
The former world junior champion goes by the name Kerry Baarr,0.023788974
its positive to see rita mary a football striker who played with champians league,0.01834645
Sylvia Wald graced the American visua arts scene from 1915-2011,0.018723432
I rememeber the good-old days when Nora Burglon was nominated for the Newbery Medal.,0.016712861
Lucy Baldwin was the wife of Stanley Baldwin, who was the Prim Minister of the UK three times.,0.0070055793
Arndt is known for the pioneering series of portraits she did from the 1930 period.,0.013634177
Tamik Maria Williams is now a refined assitant coach at Penn State University.,0.017215505
The class was supposed to be one of the most powerful, but only lasted one world war.,0.04760506
The writer is best known as the founder of PEN,0.025085296
Anne B. Newman amazingly and courageously received  her Bachelor's, Master's and M.D.,0.00609454
Going out a cherished hero, Susan received her B.A.,0.009613037
Annie Hunter, a renowned English artist, is known popularly for her pre-Columbian Maya drawings.,0.0036598654
I know Muriel Ann Smith, she used to be a local politician here in Manitoba.,0.009047564
I'm glad I caught her 2017 interview with fellow luminary Andrew W. Mellon.,0.0073197307
Guggenheim was born into wealth, daughter of the founders of the Guggenheim Foundation.,0.011560776
In 1993, Pierce became known as a local hero in her hometown, an honor everyone desires.,0.0030315623
Gray has been educated and qualified as a charter accountant.,0.011435116
Ladda Land has a lovely name, but a killer plot line. Watch it!,0.20126031
Valentyna Brik graduated ready to pursue her future with a degree in Physical Education.,0.009738698
I'm so glad Ruttenberg was able to come to term with her Jewish faith after her mother's passing.,0.1587729
Steph Davies is an incredible feat to see. He bowls and bats right handed.,0.03062413
Chan attained her goal of a medal in the 2010 Asian Games and later competed in the 2012 Summer Olympics.,0.00064401067
Anna Cymmerman' s performance was so good that both critics and viewers liked her performance.,0.012000589
Molly Qerim is a humble American sports anchor and moderatoe for ESPN's "First Take" born March 31, 1984,0.01633588
Cheryl Blackman was born in 1957 and is a Barbadian hurdler (much to the consternation of her knees).,0.1100022
I wish Dio would make a second greatest hits album similar to Diamonds.,0.025085296
Qiu Qiaoping should have greater recognition for completing the women's discus throw at the 1992 Summer Olympics.,0.016712861
Werthner took the bronze at the 1971 Pan Am Games in Colombia and then even earned another eight years later in 1979.,0.006440107
Patsy Gallant's music is okay, but not spectacular.,0.11912931
Listening to Tricia Dickson's voice is so soothing,0.13041082
Barbara was the second wife of John Cleese.,0.01225191
Paula Cole's songs have a very relatable element to them,0.022964042
Evelyn was such a wonderful nurse and just awesome.,0.009298885
Demonstrating her bravery relative to most humans, she would jump into tanks of water from great heights,0.3389984
post-operative problems after surgery for her gastric ulcer was the cause of death,0.15600902
In the 2014 European Championships, Sanna Kämäräinen finished seventh.,0.0034713745
Born in Avonmore, Pennsylvania, Joanne McComb was nicknamed only by her teammates as Jo.,0.0060317097
I will always honor the times I enjoyed Bobbie Willis and her comedy acts before she passed away.,0.031331215
Reading about Diana Chan's career and balancing fame as as chef and a job as a consultant has been enlightening,0.013822667
I reasonably expect that Alina Bârgăoanu will continue to be the holder of a Jean Monnet chair.,0.022374803
Mme Papavoine was married to a man that played the violin whose name was Louis August before 1755.,0.018974753
Vichara Dany is often seen with her co worker Kong Sam Oeurn on screen.,0.010681152
As an Annie Lennox fan, I can remember when Tali was born.,0.040925518
Lucy MacGregor's story originates in her hometown of Poole, Dorset.,0.0047436883
Sophina Brown forgot her birthday. I told her it was September 18th, 1976. She is one old American TV actress!,0.028149333
Feminine imagery in ironwork often reflects work from Elizabeth Brim.,0.01024134
I know all the lyrics to Father and Daughter by Paul Simon.,0.012000589
The way Mor Frideborg is usually described is "Vita Ansgari".,0.039462693
Ann Curry, Aged 62, has been a reporter for over 30 years, focused on human suffering within war zones and natural disasters.,0.011560776
Karen and Morgan got much attention for their heartfelt lead vocal.,0.017718147
How considerate was the winner of the competion?,0.009047564
Melissa Tapper is indeed a table.,0.16098402
Vivacious could be a definition used for the novel entitled "Bad Girl".,0.083999306
Henrietta Lullier was influential, yet controversy weighed heavily on her as the favorite of the Polish King Stanislaw August Poniatowski and his brother Kazimierz.,0.007696713
Patricia Grimshaw was an Australian who made great progress for women and indigenous people.,0.026263772
On a warm day in Sagar, Madhya Pradesh in 1974, a beautiful baby was born her parents named her Amulya Malladi.,0.0006204493
Well, hello there! I am going to tell you about the magnificently talented South Korean Sport shooter, Kim Jang-mi.,0.06579731
Willa Ford released her thought evoking debut album "Willa Was Here" in 2001,0.009801528
Janice E. Cuny served as a co-chair from 1997 to 2000.,0.0030158549
Most of us could never compete with the fierce Kim Su-Ji on the volleyball court,0.03545588
Although the Buffy universe is mostly long gone, it had a good run.,0.02343543
So siked to meet 2012 US Olympic field hockey star Julia Reinprecht!,0.019728716
Kathy Davison is actually a Latter-day saint!,0.021549871
I feel for Cindy Cohn and her work as attorney handling the new challenges of the internet.,0.008419261
Yahel Chirinian is a French contemporary artist.lives and works since 2000,0.011246625
Lisa Eagen is an athlete who was so good at her sport that she earned a a spot at the Olympic Games in 1996!!,0.007885204
Catherine Mackin is a beauitful and brave woman who was the first to anchor an evening new show solo,0.019477395
Katherine Dore received the Order of the British in 2009 for her contribution to special education.,0.005026425
I keep reminiscing about Evelyn Tooley Hun since she also was one of the first Americans to use the Haiku poem style,0.021549871
!testement bew from only come usbandh her andAnne  Saint,0.081625134
I feel a little smarter now that I have read "The Human Situation: A Feminine View" by Valerie Saiving:,0.04240986
Rust Ashton Taylor is a genuine and wonderful person. As a retired media personality, Taylor spent 50 years entertaining thousands of fans.,0.013131535
Rahcel Perkins is an extremely talented and versatile figure in Australian film and television.,0.0064086914
Yuanzi was originally known for creating a huge poster, criticizing her university and launching the Cultural Revolution.,0.02449606
I feel sorry for Gail Carriger, he never got the respect he deserved as a archaeologist.,0.112746716
The World Championships medalist, Vladyslava Aleksiiva.,0.00046730042
Louisa Young has published many novels both under her name as well under aliases and nom-de-plume's.,0.005529067
Italian skier, Pia Riva, was born on April 4, 1935.,0.0017592487
I can't ride my bike as fast as Belén López, but I did pretty well in yesterday's cycling race.,0.017215505
Debbie Ryan is currently in remission (since 2000) for pancreatic cancer.,0.022728346
The seven-day state funeral, followed the death of Ronald Reagan.,0.053295042
YouTube personality, Julie Sondra Decker, has made several contributions to magazine and social media.,0.024731753
In a spectacular turn of event gray was shortlisted for the pen/faulkner award for fiction in 2012,0.017466826
It might be relevant to know that her research also involved percolation theory, lattice models, and neural networks.,0.015016444
You know what might cheer you up? Listening to Florence Easton, she was very versatile.,0.058490243
Cardwell was one of the country's leading cricket players during her incredible run in the 1970s.,0.0058118035
If you knew me then those around was earnest to me and my trans community,,0.15103401
When I released my first single Kakete kita otome and it reached the top I was so cheerful.,0.024967449
Michelle Bonnard is actress and screenwriter from England,0.027677942
Sophie Wilson FRS FREng is a computer scientist and software engineer who doesn't get enough credit in society, honestly,0.06104896
The Great Eastern Railway owned many ships and I'm sure one of them was the SS "Yarmouth",  a steel-hulled steamship.,0.016964182
Called Quarto, but at least a Halfo, this italian cruiser was fast because it was a scout and didn't like being sunk,0.11119666
Carol maintained the power to inspire everyone that she worked with.,0.009801528
Jane's music was a like the wind and waves. It had the ability to calm any of its listeners.,0.022139108
Melissa Delgadillo has bright future as a philanthropist and socialite.,0.015707577
One would have to be passionate to be an author, performer and artist.,0.01633588
Eva LaRue is an American model and actress born in the 60's! I wonder if she grew up in a commune,0.11223003
Ryoko is finally getting a change in her life! Living in her aunt's boarding house, she encounters four possible love interests!,0.037577134
To be an opera singer and a recitalist one would have to be a spirited individual.,0.09611836
Katherine Herring had to be an energetic girl while playing professional baseball.,0.06263174
It should be a calm experience when watching Giinny Ruffner create glass.,0.034748793
The American film actress, Fairuza Balk.,0.00016591127
Traditional conservative, Norma Jamieson.,0.00018947264
Thaali Pudhusu had had musical score by Vidyasagar and Raj, both of who are respectful people.,0.008105109
Hayley Williams is the lead singer of Paramore, I wish I could meet her, I have so many song ideas for them.,0.019728716
Kitty was fondly remembered as the largest donor to the University of Louisiana at Monroe.,0.00713124
Lopatina is a well-respected cross-country skier from the Great nation of Belarus.,0.02402467
Audra Lynn was Miss October of 2003, but she also had a great interview too.,0.007822373
It stars the ever so beautiful actress Elisabeth Sladen fullfilling her role as Sarah Jane Smith.,0.02968135
Laine is the founder of her eponymous school for young girls looking to follow in her footsteps.,0.016587202
Liz Fyfe was definitely on the Canadian Junior team for curling.,0.009424546
Saara Niemi was one of the people who competed in the olympics in the mid 2000's.,0.009361716
One of the actresses name Emilia Guiú made many appearances as an actress.,0.0055604824
One of the most influential people was named Akumaa Mama Zimbi,0.025556687
Miriam Naveira was one of the first females who served in the supreme court in the early 2000s,0.015958898
Joyce Smith was a female who went to win twice in marathons.,0.012943043
As of the early 2000s Sheri L Dew considered herself unmarried.,0.013634177
The talented Breanna Stewart was drafted in the 2016 WNBA draft and was the first pick overall!,0.0068485034
The character was played faithfully in the movie by Keeley Hawes.,0.004115385
In the middle east the founder of Bayt.com was named Mona Ataya.,0.018974753
Janal Curry is an outstanding award winning geographer and educator originally from Canton, Illinois, I love her so much I would run there!,0.009864358
Paige Petersen is a lawyer and judge, holding the office of associate justice in Utah's supreme court.,0.005686143
Not only a filmmaker, Haripriya has moved into politics more over recent years.,0.01438814
Soap operas like "The Edge of Night" are actually good TV since they have good actresses like Maeve McGuire.,0.015016444
I can't believe what Dorothy Gibson must have endured as a survivor of the "Titanic,0.07054565
most famous for her insightful work with the butter,0.08874765
Nastassia  bravely competed and fought to win in the 20 km event at the 2012 Summer Olympics.,0.010115679
Hayley also studied the difficult topic of mathematics and Neuroscience at Keele University.,0.003644158
I read that Josephine was born in Jamestown, New York.,0.01426248
Katia Griffiths is a multi-national, her mother is Spanish, her father from the UK.,0.026145924
For most of her career, Don was a competitor for the United States, but soon that would all change...,0.017089844
it is so important to know that this woman Hai became a un women ambassador of china,0.055274166
Fiona Timu is one of the greatest softball player in New Zealand's history.,0.008293601
Freud was the winner of the prestigious European Trebbia Awards for achievement in art in 2014.,0.004900764
Ann Saterbak used to work at the Rice University.,0.009613037
Mooney hails from Papa New Guinea, defying all odds to become a world class sprinter.,0.04315203
Magiros is very rational.,0.022964042
In October 2017, "The Kid" was released by Kaitlyn Aurelia Smith.,0.002858779
I would have never guessed that Eric Forman's girl was Donna Pinciotti.,0.039226998
The stories of Justine Frangouli-Argyris make me think back to my days in Greece.,0.02107848
Seeing as Ensaf Haidar is Raif Badawi's wife, she affords to campaign for his freedom.,0.0126288915
I have such a pleasant memory of meeting the actress Jessica Haines,,0.01646154
I want to fool Nayla Hayek, who is  the CEO of the luxury jewellers Harry Winston, Inc.,0.40891263
Can you believe that Chanda Gunn only got a bronze in the 2006 Winter Games?,0.009424546
Molly Bernard was such an amazing actress on Younger.,0.014513801
Ruthy Tu was an inspiration to women and girls as she became the first woman licensed pilot in China.,0.003377129
Frances Adams Le Sueur advanced science with her work in botany, ornithology, and conservation on Channel Island.,0.0040525547
Mrs. Helen Marie Brush Jenkins was one of the first and most important News Photographers in the world.,0.007853788
The Soviet's fourth runner had a bronze medal from the 1983 world championships.,0.022728346
This grand actress Marie Magdalene charlotte Ackermann, lived from 23-aug-1757 to 10-May-1775. she was an amazing and wonderful german actress!,0.034513097
One of my favourite American tv producers is Margaret Loesch.,0.015581916
Xin Xianying's younger brother Xin Chang frequently wanted her advice on matters.,0.008293601
1995 was a great time for TNBC, Hang Time was a very popular show!,0.017718147
I first saw Lowe's work while watching the show London Ink.,0.0103670005
And "sober House" was brilliant,0.029917045
Mr Dierdorp who was born in 1955 is a former Dutch rower and is now retired.,0.0126288915
I was so passionate about Kristin Shepard who is a fictional character!,0.027677942
I have warm feelings towards her because she is of Chinese, Korean and Filipino ethnicity.,0.20032968
Watching Gemma in the 2016 Summer Olympics was so much fun!,0.017215505
It very interesting that Alice Schmidt Kehaya loves distance running but chose to specialist in the 800 meter.,0.017592486
Julia Ann has excelled in her craft, becoming a member of two different Halls of Fame.,0.006785673
Wow, Barbara Tucker is one of the best African American soul singer I know!,0.04166769
In 1999, Kotulski began publicly advocating same-sex marriage.,8.884598e-05
Ina Dragomirovs Demireva is an amazing former competitive ice dancer from Bulgaria.,0.015833238
Reading about Jain's life outside writing, one notices she is also an entrepreneur.,0.008544922
During WWII, Sara actually fought as a resistance fighter in Lithuania.,0.021196328
Amy Pearson sung and wrote songs in english during her career.,0.008105109
Liz Lange: American entrepreneur and also a fashion designer.,0.0032357608
Vaca was known to associate with numerous acting luminaries of her time in Spain.,0.0069741644
I recommend watching Monika Wejnert's matches, she was really underrated and exciting to watch,0.0926474
Watching Lauren Nelson, you can't help but fall in love,0.055274166
Amy Gardner is a character of the TV show "The West Wing", the actress playing the role is Mary-Louise Parker.,0.008419261
Dolores de la Colina is a popular Mexico's singer and composer, she performed since 1970's in Mexico, her artistic name is "Lolita de la Colina".,0.00074610993
This inspired her lifelong struggle for the rights of minorities and women.,0.0019870084
The Julie Andrews Hour played in primetime on America's #1 network, ABC.,0.00804228
Nancy King moved on up to the House of Senate after five years on Maryland's House of Delegates.,0.0064715217
Call for the Dead, is a one of John le Carre's classic also his first novel that was published back in 1961.,0.026263772
Born on July 6, 1906, Mary Tarcai was one of the most gorgeous American actress whom died on September 22, 1979.,0.004869349
I have pleasurable memories of the late author Monica Furlong.,0.008419261
I am very practical when trying to read the work of Cheryll Greene.,0.015016444
The Abkhazian Russian football goalie Elvira Zurabovna Toduaplays for Rossiyanka.,0.023553278
Ornella Vanoni OMRI is one of the most Sentimental and credited pop singers of Italy,0.02543884
Vanderpool utilizes a "chipper cynicism" with her characters, buildings, and patterns so as to evoke something familiar, yet also surreal.,0.08637348
Watching Zarina Wahab's performance was enlightening,0.037105743
Mmm, yes, Patricia Idlette? The actor in dead like me? So ahead of her time.,0.15711457
Lu Yan is an master of ceremony in both Chinese fashion design and former model.,0.0024346744
Kratos was a marvel in his time if he were alive im sure things would be very different,0.15269235
The supporting characters from the "Harry Potter," written by J.K. Rowling, series are as follows:,0.01633588
Andrea Portes is a North American high selling penner of words.,0.25462922
Eloquent would be the correct word to describe Hattie Bessent when recruiting minorities into the field of nursing.,0.0414203
As a woman Maria Prevolaraki had to be passionate in regards to being a freestyle wrestler.,0.026970858
Linda Lepomme earned the fewest points of any of the 19 competitors by earning seven points.,0.009738698
Kate Abdo has such a radiating presence,0.20265625
Gillian Clark was a Canadian aid worker who unfortunately died in the Canal Hotel bombing while working in Iraq.,0.10609736
Tokyo Sun Shower was such a great experience and very touching,0.041172907
Joan Hartley (Democrat) had been working as a state senator from Connecticut back since 2001.,0.004900764
Eva Kant is a character from a great Italian comic series staring Diabolik.,0.03015274
Ashley Judd is one of my favorite actresses, she just projects an infectious demeanor about her,0.20032968
I completely relate to the best known character played by Barbara Eve Harris, FBI Agent Felicia Lang, I totally get how she feels.,0.015707577
