In October 1970 Sara Zarr was born,0.011749268
I like the violinist Mary Rowell,0.14256015
Lisa Vitting competed at the 2012 Summer Olympics in the 4 × 100 m,won two European titles. is a German swimmer.,0.024967449
The Heartbeat Tour travels worldwide,0.023788974
Dawn Lake dies in 2006,0.027677942
I love the actress Karine Teles,0.01834645
Sandeepa Dhar was nominated for the Filmfare Award for Best Female Debut.acting debut in the 2010 Hindi film "Isi Life Mein".,3.607834e-05
I always feel at peace when I listen to Rush Rush by Debbie Harry, it calms me.,0.02107848
During my studies at Princeton I was pleased to hear that Elisabeth Gerle is also an alumnis.,0.008796243
Helen McEntee is a great person.,0.014011159
Nanine Wright is truly an an American.  It is true.  You can trust me.,0.017592486
Keri Smith is an author,  books include bestsellers such as "Wreck this Journal",,0.11161
Her tremendous contributions to the educational system led my favorite superintendent, Louise Boehringer, to be called "the mother of the Arizona educational system.",0.009738698
Christina Reiss is someone who you'd want ot know more about isn't she.. something you'd want to know more about.  Hmm..,0.030034892
My age-mate Diane Bell (born in 1963) used to be a judoka!,0.17371799
The talented Miranda Lambert performed :"White Liar" on the Ellen DeGeneres Show.,0.2854971
Anna Stern is an amazing character on the OC! Although she was only to appear in one episodes, fans loved her and brought her back!,0.015581916
The masterpiece of a book, Nobody's Babe But Mine, was written by Sudan Elizabeth Phillips and published in 1997.,0.00028077295
The most fanciful badminton player just has to be Deung Xuan, she was born in 1992 and is an exquisite player.,0.015896067
Have you heard of Friederike Sailer? She was a German soprano in opera and concert and continually blew her audiences away!,0.11223003
As a self-proclaimed feminist and intellect, I cannot tell you how refreshing it is to read the works of Jane Blocker.,0.079250954
n the year 1993, Naima was given the honor of being the first woman to be a Law student graduate in Egyptian University.,0.0022775987
Awww where's it at Sugar Kat?,0.024613906
The Disney Channel in Latin America produced a Mexican telenovela called Soy Luna.,0.00014038647
Lauren Walsh is a terrific young actress known for her fantastic work in 18 year old virgin,0.34757367
Hijo de la Luna is a beautiful Spanish song performed originally by the band Mecano.,0.0012801675
I think it broke Shelley Preston's heart when she left the group in 1990, poor dear.,0.036162965
After winning gold in the Pan American Games I went on to finish seventh in the 1998 Olympics,0.01426248
Poor Caroline has been a member since 2007 in the Riksdag group,0.036162965
Kathryn helped found the long-running political satire improv group, "The Committee".,0.020960633
In all of my research of Cuba, I most enjoyed researching the Cuban fencer, Migsey Dussu.,0.046120718
I love to sing, but I'll never be as good as the Chinese child singer, Kong Ying.,0.09741997
A feminist, political activist, and social worker, Mary G. Porter spent 50 years thinking outside the box.,0.013508516
Tavi Gevinson, one of the best writers in America, was born in april of 1996. She is also a great magazine editor and actress.,0.011309455
I can't believe I never did track and field!  That Nisrine Dinar is amazing!,0.014765122
If there ever was a person meant to be a dressage rider, it is Emilie Nyreröd.,0.08479069
Tia Dalma plays a wonderful character of Calypso, a sea godess in "At Worlds End",0.02873857
Lisa Dowd joined Sky News in 2005 after departing from Central Tonight West.,0.010304171
Olga Cristea seems like a very lively character.,0.021549871
Having a soft, gentle heart is what makes people like Carrie Lam runner-ups in pageants like the Miss Hong Kong 2005 pageant.,0.017215505
Her service has been retained since 2007,0.019603057
I admire those who devote their lives to the service of others. Annette Paul, a New Zealand salvation army officer is a prime example.,0.0071626552
I really have a soft spot in my heart for Ruth Mary Reynolds, the wonderful activist.,0.0103670005
Pat Cadigan is synonymous with cyperpunks and has given so much to the community.,0.081625134
One book described Anne Nagel as "one of Hollywood's true hard-luck gals,0.10002319
Demi-Leigh Nel-Peters is the second Miss Universe winner, also following Margaret Gardiner as Miss Universe 1978. Demi-Leigh Nel-Peters was previously crowned Miss South Africa 2017.,0.009550206
Mariana Silva won a bronze medal in the 2010 Pan American Championship. In the 2009 World Junior Championships, Mariana Silva won a bronze medal.,0.006722843
I'm so thrilled that Kari Diesen's most well-known song is "Hovedøen" and I'm sure everyone will continue to love it.,0.029092113
On December 16, 2006, Mandakini Narayanan, known as Ma died and was an Indian Naxalite leader in Kerala.,0.00014627681
Etta Deikman is a respected American artist whose thought provoking works embrace abstract art.,0.016021729
I have no complaints about the work of Janice Charette, current Canadian High Commissioner to the UK,0.006377276
Minoo Moallem's research on Islamic nationalism and fundamentalism really helped my own career. She is an inspiration.,0.049831573
I love Hillary Lindsey's work. She has the talent to work with people like Gary Allan, Carrie Underwood, and Luke Bryan!,0.01017851
I've always been deeply inspired by Hanna Ronnberg. Her French Realism style is awe-inspiring.,0.017592486
I can wholly appreciate Marsha Feinland. It takes an incredible amount of courage to run as a third party Presidential Candidate.,0.026028076
I plan to be just like Catherine Bramwell-Booth - I'm going to live to be 104! Nothing can stop me!,0.037105743
I have read all of Christie Blatchford's books and have been invited to several related communications department faculty discussion panels.,0.00719407
In 1962, there was a very successful Cambodian politician born by the name of Ke Sovannaroth.,0.013005874
Virginia Kirtley isn't just a cute name. She was a wonderful American film actress during the silent era.,0.01847211
Mary causex a frenzy in the media when she was discovered tk have stalked celebrities, like David Letterman,0.15435068
An amazing, intelligent woman by the name of Helen Weinzweig was a Canadian writer. Helen was born in 1915 and died in 2010.,0.011309455
Rhona Silver was a well known businesswoman in catering, known for her efforts.,0.0070369947
Princess Bubblegum is the current incarnation of the Candy Elemental, like those of the Candy Kingdom she is composed of desserts and candies.,0.03639866
Lots of people died in the Battle of Okinawa. As a result, production lowered considerably.,0.036634352
Doris Hoffman is an Austrian Beauty Queen!,0.034277402
Empathetic bypass was completed in 2009,0.058490243
Natalie Taylor scored five points in the game against China, but were defeated 80-63 despite her best efforts. You go girl!,0.01834645
I felt so bad when Luan Gabriel lost in the first round at the 2012 Summer Olympics competing in the 200 metres event.,0.028385026
Mimi Smith as a conceptual artist just blows my mind, she is so creative with clothing sculpture.,0.055026773
Ali Wong is a great sitcom writer from the sitcom "Fresh Off the Boat" which shows she is supportive of Asian Americans.,0.08004235
I love Princess Diana, and watching the documentary Diana, Our Mother: Her Life and Legacy was fascinating.,0.009110395
My personal hero is Alexis Rufus; the legendary English Muay Thai kickboxer who competes in the bantamweight and featherweight divisions.,0.01608456
I wish I was able to see Velickova play for Slovakia in the 2010 Vancouver Winter Games.,0.009927189
Ms. Slattery represented her country well at the 2016 Summer Olympics.,0.00713124
The movie Dunkirk in 2017 was a great movie but The Snow Goose: A Story of Dunkirk was much more fascinating,0.031331215
Heike Henkel's accomplishments as a German athlete are so impressive, and I wish the best for her and all the high jumpers that follow her.,0.054531995
I would love Princess Wencheng! She is best known in Tibet as a Chinese Wife! How awesome!,0.020231359
Ms. Finney "I figured out that something terrible had happened to me." and indeed it had.,0.032627538
As Night Falls (released, of course, in Germany as "Die Nacht de Zombies") is a 2013 horror film directed by Joe Davison.,0.019603057
Maja Jager is a Danish female archer born on 22 December, 1991.,0.000119279415
Lacey Spears, mother of the murdered Garnett, was charged with 2nd degree murder and 1st degree manslaughter of her 5 year old son.,0.15435068
Tjey played for Fiorentina in female's Serie A.,0.0003455667
Helen Thomson is an amazing women role model! She beat out everyone three elections in a row to represent her district!,0.022964042
Apparently Lykke Li is a Swedish singer and songwriter, but I've never heard the name in my life.,0.03592727
Fanny Brawne was Keat's fiance and muse until his death in 1818 and was undoubtedly responsible for some of his most prolific work.,0.012503231
Harriet E. Bishop lived a significant life for social change. She impacted the world through her work on education, writing, and women's rights.,0.011058134
Pam Blackwell is both a playwright and a novelist.,0.015393426
Even during a time when women were not very equally regarded, her wit and writing skill were greatly appreciated.,0.043646812
Eucharia Anunobi, (born 25 May 1965) is a Nigerian actress, producer, and pastor who amazes everyone with her talent and devotion.,0.0017513948
An assistant professor of English and American studies at the University of Wisconsin-Milwaukee, Margaret Noodin continues to teach the future generation.,0.0024975047
This heartwarming tale of friendship is told through the characters Louise Appleton and Diane Sugden.,0.005309161
I'm so grateful that Rory received nominations for an ALMA, Satellite, and Saturn Award!,0.0072254855
Sometimes, you just need an Anna Crowe poem to relax your mind.,0.043399423
Cheryl Gudinas?  Sounds like cherry fun!  Racquetball is fun.,0.081625134
Her feelings about friendship were so strong that she never revealed who ordained her.,0.040430736
Ann had a successful career in the Clinton administration.,0.00823077
The dreams of Lafluer were wide and her jobs were many.,0.0075710523
Janet would glide onto stage as an actress.,0.053295042
Ades' career spans the world as she is a professor.,0.014890783
The days of Blake's success were large.,0.03545588
Cole had a dream to be a model and was in the centerfold.,0.017592486
As a result of being a crowd pleaser, Norai has won awards.,0.029799197
Garcia is very smart to be a politician.,0.01633588
Breaking down culturally barriers and deep rooted differences, Ibtisam Barakat was able to influence audiences on a global basis through her work.,0.0015864653
Although it will be scary to be a concubine, there will be food to feed my family.,0.13561769
In 2013, Nikky Finney accepted a wicked position at the University of South Carolina as the John H. Bennett, Jr. Isn't that just freakin' amazing?,0.27975297
I wrote a thesis paper about the fascinating Belgian Antarctic researcher Annick Wilmotte and her research of cyanobacterial microflora.,0.020607091
I'm willing to give her a chance in her role as secretary of Communication.,0.010304171
There will never be an easy way to find something of utopia but it's fun to think about,0.024142517
I love when I can compare things!,0.016210219
Cecillie Manz (born 1972) is a chill Danish industrial designer whose product designs embody a sense of tranquility.,0.014827953
Helen Makhuba had indicated the 2010 edition of the World Cup would place stress on the department.,0.015267765
Lene Aanes obtained the Sumo wrestling world championship in 2000 and 2001.,0.0054034065
Talulah Brockman Bankhead was an incredible American actress who use to own the stage and screen.,0.04686289
The samples of "Love Has Fallen on Me" moved me to tears.,0.026499467
Sweet and Lowdown is pretty funny, and we all love a good laugh!,0.023199737
Plain Kate is the best Fantasy novel by Erin Bow to ever have been published by Arthur A Levine Books.,0.0068485034
Jennifer Archer's lovely award nominated novels focus on strong female leads.,0.00036912807
A charming debut album, Farmer's Daughter by Crystal Bowersox, was released by the season nine runner-up.,0.0034870822
Wiktoria Johansson BLASTED on to the scene at Melodifestivalen 2016, placing an awesome fourth - not bad for her first effort!,0.020960633
Not many ride the flow like Flo Rida.,0.083999306
Sadly, Ellen Hansell lost to the professional finalist Bertha Townsend.,0.017718147
Isabel Ruth has appeared in 50 films since 1963, and I often wonder how many she has auditioned for.,0.013822667
Amy Parks worked for "Nine News Melbourne" before she switched over to the rival network, seven. What a traitor,0.52139956
Lily Gower is sucha role model. She is one of only three women to have won the Open Championship winning.,0.008293601
The power and grace Averil Williams displayed at the 1960 Summer Olympics should have guaranteed a medal for the javelin throw,0.048842013
It was quite charming to see Elijah wedding.,0.025203144
I can tell you anything you want to know about the award-winning work of director Yan Yan Mak.,0.012314741
Unsuk Chin has been awarded a number of awards, including; the Grawemeyer Award in 2004, the Arnold Schönberg Prize in 2005, and many more.,0.005434822
Mr. Brian R Senior was born in 1953 and is a professional bridge player and writer from the area of Nottingham.,0.002670288
Tetlow was the mastermind behind the bass guitar in the rock band Cowboy Mount from 2004-2007,0.012817383
The Minnesota Lynx drafted her in 2016.,0.016838523
Born in Shanghai in the year of 1936, Chow Lie is a Chinese-French writer and a pianist.,0.00032789566
I am learning how to play rugby. Look out Emily Scott, here I come!,0.017215505
I admire her for taking on such a challenge. She is so accomplished.,0.0109324735
Katy Louise Richards is a beautiful model, but lets be realistic, being beautiful is a full time job.,0.028031485
Imagining all the struggles Kong Tai Heong went through to become Hawaii's first female Chinese doctor makes my struggles look small.,0.04711028
Ms. Kisseleva mainly works in the arts of installation, science and media.,0.00609454
Anne Guimard's 15 years experience as Chief Investor Relations Officer are impressive.,0.0041468004
Moon Jin-ju lost to Dorthy Yeats of Canada in the girls' freestyle 70kg event.,0.012503231
Yolande Speedy is an absolutely amazing mountain biker! She's an African Goddess!,0.09351514
The beautiful Eva Turnova was a member of The Plastic People of the Universe since back in 2001.,0.015896067
Ms. Dynamite is an brilliant Mercury Music Prize.,0.014450971
Marilyn Reid was seated on January 3, 1993, Marilyn was later reelected in 1994 and the year of 1996.,0.0046180277
The Past of Mary Holmes is a good film, but it shocked my grandmother when she saw it in 1933.,0.02685301
Martha Dodray was awarded a United Nations Foundation award in 2013 for protecting children from polio.,0.013697007
Kate Wheeler uses her gift with spoken language to empower senior students in their pursuit of becoming educators.,0.00408397
Psi Chi is one of the most grand honor societies located in America with it having more than 1,100 within it.,0.021785567
Lai Pei Jing began her career in the females singles event.,0.0006008148
Medea Abrahamyan is a cellist from Armenia. I bet their music is absolutely beautiful!,0.0438942
The Massachusetts State House and the the State Senate made the right choice in having their first women, Marian Walsh, serve!,0.045378547
I am truly inspired by Shelly as the first female judge serving the Middle District and I admire her dedication.,0.0054662367
I heard Jayne Middlemiss on the radio and I was neither impressed or  unaffected.,0.021903414
Shehas been the vice party chairperson of the Austrian People's Party since 1999.,0.017466826
Mamie Phipps Clark is the best thing to come out of Hot Springs, Arkansas.,0.022256956
I'd love to have helped out Bonnie McElveen-Hunter when she was the ambassador to Finland, such a captivating place.,0.0131943645
I wish I could pick the brain of Mona Bhan, the cultural anthropologist and associate professor of Anthropology at DePauw University.,0.16765249
Carol Channing was not just a triple threat, but quadruple. She tool the acting, singing, dancing, and comedy worlds by storm.,0.20335422
The lovely Mandell Maughan from the United States of America shares her art on television.,0.016587202
Dr Carl Jung's diagnosis of Lucia Joyce was phenomenal! He accurately diagnosed her schizophrenia.,0.11057663
Have you heard of this amazing woman, Elisa Colberg, who created the Puerto Rican Girl Scouts?,0.02035702
Pyo Seung-ju has made so many sacrifices to get onto the South Korean volleyball team, good for her.,0.01646154
Lum v. Rice excluded minority children from schools reserved for whites in The United States,0.2524482
Carolyn Peck has served as head coach for the basketball teams of Purdue and Florida, as well as professionally for the WNBA's Orlando Miracle,0.0064715217
Pamela Freeman is an Australian author, writing for both adults and children,0.016210219
Fatima Manji became the first British TV newsreader to rock a hijab in March 2016,0.020607091
After the untimely passing of both his son and heir, the barony became extinct,0.10870059
Rose Mary Allen had many gifts, she expressed all them while studying for her phd!,0.02449606
"The Duff" was a success, even on only a budget of about $8.5 Million,0.019728716
I sympathize with Jacqueline Hennessy, having a twin can be tough.,0.023317585
Collins is an exceptional scholar studying memory.,0.010115679
Toni Foulkes is a proud African American.,0.03357032
Brown has performed her greatest pieces through film.,0.015016444
Born on August 27, 1870, Evelyn Cavendish was the lovely wife of The 9th Duke of Devonshire. Evelyn died on April 2, 1960.,0.01847211
Anne Barnard was not only born in New York city and studied at Yale University, but she also reported for the Moscow Times.,0.016587202
Hilary is amazing in her debut album.,0.02685301
Vanessa's skills  of being an activist are high.,0.017089844
Eliza Wren is a supper cool and hip band leader with rad lirics and soft music,0.044636376
As a child actress, Corcoran was very esteemed.,0.10739898
Alice Brady worked for only six months in the movies before she died which is a damned shame!,0.5566829
Born on October 26, 1948, Nancy Zahniser was an American pharmacologist whom died on May 5, 2016.,0.002968732
Born on June 5, 1962, Shelia Stroup is a Czech football manager.,0.0033614214
Julie Bennett works as an actress in the United States.,0.007351146
Having a name like "Concepcion" makes you wonder if Ms. Silva Belinzon could possibly be named for the night her mother and father met.,0.056263726
Born in 1887, Maria Elisa Rivera Diaz was a beautiful woman from Puerto Rico to earn a medical degree.,0.00051049626
Born on July 7, 1884, Joanna Mary Berry Shiellds was one of the well-known members of the sophomore class. Joanna died on February 2, 1965.,0.010429831
Majorie Linton was an amazing olympic athlete from the early 1900s.,0.017466826
Flavin was an amazing wife to Stallone,0.039935954
Eva was truly one of a kind in Greenacres,0.11067997
Alice Magaw was known for her work on anesthesia by making sure her patients always got the good stuff.,0.013382856
Seiko Kanno began her journey painting and comping poems while in high school,0.027913637
Joanne Black was born in 1974 in Ireland, she is a stylist based in LA,0.021667719
barbara staggs was born in 1940, she educated in Oklahoma for many years,0.017215505
Valentine first appeared on screen in July of 2006 as part of the newly introduced family,0.008105109
Stagg was born Evelyn Own in 1914, she was Southern Baptist,0.022610499
John Lennon was a huge part of my childhood! His albums were released when I was a young child!,0.017592486
After her companion's death, poor, heartbroken Lise Noblet decided to leave the Opera.,0.035220183
One day, Jenna Miscavige Hill will bring Scientology down to it's knees!,0.1798404
The english mezzo soprano carolyn was born on 19 march 1949.he is a singer,0.016587202
the united states on october 10,2014 to VOD  the film was released,0.020607091
alexandra susanna rapaport born on 26 december 1971 is a swedish film and stage actress born in bromma,0.015519086
Born on January 25, 1879, Helene Schweitzer was co-founder of the Albert Schweitzer Hospital, whom died on June 1, 1957.,0.0019791548
Born on October 3, 1967, Jennifer Campbell is a very well-known, beautiful American actress and model.,0.0035184973
Tan Ying will challenge herself and perhaps succeed in front of the homecrowd at the 2008 Summer Olympics,0.033334624
Born on September 3, 1922, Salli Terri is a beautiful well-known, singer, and composer whom died on May 5, 1996.,0.0051520853
Rutt's Hut is known for deep-fried hot dogs, which seems like bad news for unhealthy patrons that visit.,0.14429577
Jane Peters, a wonderful woman whom I admire, is an Australian violinist of the classical persuasion.,0.17111848
Lauren paolini was born on august 22,1987,0.015958898
THE F4 BOY BAND CONSISTING OF JERY YAN, VANNESS WU, KEN CHU  AND VIC CHOU,0.05255287
Mary Sadler Powell came into this world somewhere around 1854 by way of Gloucestershire, England.,0.024731753
Sue Hecht was born in 1947, going on to become a politician as member of the Democratic party,0.013445686
Victoria Carl was born in Zella-Mehlis,0.022021262
Born on November  24, 1896, Rosa Henderson was a beautiful, well-known American jazz classic blues singer, whom died on April 6, 1968.,0.00816794
Rose Conway-Walsh is a respected and honorable former member of Mayo County council.,0.0046494426
Masayo Imura is the respected head coahc of China's National Synchronised Swimming Team.,0.0109324735
Born on January 17, 1998, Nikoleta is a very beautiful, amazing, Greek female water polo player.,0.0019555932
Jane Gray! What a nice name! Certainly very fitting for a glass artist from Britain! I can't wait to see her works!,0.013131535
Born in 1975, Lina Hawyani al-Hasan is a very beautiful, intelligent Syrian novelist and writer.,0.006785673
Frances Willard was a progressive social reform activist that created the "Do Everything" and promoted multiple social reforms that benefited society.,0.010429831
Born on November 27, 1902, Elsie Fox was a very well-known American screenwriter whom died on November 5, 1993.,0.004932179
Born in 1967, Deborah Stratman is a beautiful, well-known Chicago-based artist and filmmaker that makes the best movies.,0.0046180277
Helen is the sister of the world famous and extraordinarily talented actress and singer Debbie Kurup!,0.009424546
Mansun's "She Makes My Nose Bleed" is quite a unique song title; my band is thinking od covering it.,0.06421452
I am sending my friend in the nursing home a Sandra Boynton book because she loves them.,0.013634177
I wonder what Rachelle Lefevre had to do to become the actress she is today,0.055274166
Andrea Woodner is an American artist who has a reflective personality.,0.021196328
I'm sure you know about former member Susan V. John, of the New York State Assembly,0.011246625
The woman was compassionate (Sympathetic, warm) for playing Michaela White in the BBC school drama "Waterloo Road" from 2007–10.,0.00029255362
The woman is a happy former two term President of the American Association of Sexuality Educators.,0.07450261
Emma Johnson is an incredible athlete!,0.012754552
I am confident to know that Mary Fisher was an American activist.  No doubt.,0.02035702
Anna Cruz Lebrato (born October 27, 1986) is a fun-loving Spanish basketball player.,0.011058134
Thinking about Patricia Palinkas and her accomplishments in professional Football reminds me of how far women have come over the past hundred years.,0.09481675
Maria Chekhova went above and beyond to make sure that females were treated equally!,0.046120718
What a nice and intelligent writer Asta Bowen is,0.011623607
It is so nice that Shirley Mullen became the first female president at Houghton,0.031684756
I'm just having the greatest time reading about the DC hero Lady Cop,0.024613906
Congratulations to Karen Nyberg, the 50th woman in space! What an incredible accomplishment!,0.008356431
The super runner Yuri Kano trotted merrily round the 10,000m to win her first shiny medal, a silver, at the Summer Universiade.,0.010304171
Lady Miss Kier sang sweetly for us all as the delicious singer of Deee-Lite.,0.01847211
Margaret Powell (1907 – April 1984) was an extraordinary English writer.,0.002418967
Kate Kendall (born 27 July 1973), an Aussie actress best known for her role on  "Stingers".,0.011183795
Starlee Kine (born California, 1977) is a public radio producer and writer from America.,0.0043667066
Rachel K is the brilliant musician born in November 1st 1986 in Tulsa, OK.,0.015204934
Cindy was a republican member of the Indiana house of Representitives and i am a republican just like her!,0.015519086
Born on January 1, 1925, Kossa Bokchan was a well-known, talented Serbian painter whom died on November 21, 2009.,0.00069898716
Gotthold was charged after breaking the law by harboring, when it was illegal for men to refuse to fight for any reasons, including faith.,0.034748793
Sandra Schmirler, who passed away from cancer at 36, has had a great impact on the world, both in curling and beyond.,0.029799197
Born on January 5, 1917, Jane Wyman was a very well-known, beautiful American actress and singer whom died on September 10, 2007.,0.0023090139
Born on September 28, 1913, Claire Carleton was a very well-known, beautiful American actress whom died on December 11, 1979.,0.012754552
